[
  {
    "sample": "sample1",
    "sample_name": "ABC",
    "metadata_1": "2000-01-01",
    "metadata_2": "2000-01-02",
    "metadata_3": "2000-01-03",
    "metadata_4": "2000-01-04",
    "metadata_5": "2000-01-05",
    "metadata_6": "2000-01-06",
    "metadata_7": "2000-01-07",
    "metadata_8": "2000-01-08"
  },
  {
    "sample": "sample2",
    "sample_name": "DEF",
    "metadata_1": "2000-02-01",
    "metadata_2": "2000-02-02",
    "metadata_3": "2000-02-03",
    "metadata_4": "2000-02-04",
    "metadata_5": "2000-02-05",
    "metadata_6": "2000-02-06",
    "metadata_7": "2000-02-07",
    "metadata_8": "2000-02-08"
  },
  {
    "sample": "sample3",
    "sample_name": "GHI",
    "metadata_1": "2000-03-01",
    "metadata_2": "2000-03-02",
    "metadata_3": "2000-03-03",
    "metadata_4": "2000-03-04",
    "metadata_5": "2000-03-05",
    "metadata_6": "2000-03-06",
    "metadata_7": "2000-03-07",
    "metadata_8": "2000-03-08"
  }
]