[
    {
        "sample": "sample1",
        "sample_name": "1",
        "metadata_1": "2000-01-01",
        "metadata_2": "2000-01-02",
        "metadata_3": "",
        "metadata_4": ""
    },
    {
        "sample": "sample2",
        "sample_name": "2",
        "metadata_1": "2000-01-01",
        "metadata_2": "2000-01-03",
        "metadata_3": "",
        "metadata_4": ""
    },
    {
        "sample": "sample3",
        "sample_name": "3",
        "metadata_1": "2000-01-01",
        "metadata_2": "2000-04-01",
        "metadata_3": "",
        "metadata_4": ""
    },
    {
        "sample": "sample4",
        "sample_name": "4",
        "metadata_1": "2000-01-01",
        "metadata_2": "2000-12-31",
        "metadata_3": "",
        "metadata_4": ""
    },
    {
        "sample": "sample5",
        "sample_name": "5",
        "metadata_1": "2000-01-01",
        "metadata_2": "2001-04-01",
        "metadata_3": "",
        "metadata_4": ""
    },
    {
        "sample": "sample6",
        "sample_name": "6",
        "metadata_1": "2000-01-01",
        "metadata_2": "2001-12-31",
        "metadata_3": "",
        "metadata_4": ""
    },
    {
        "sample": "sample7",
        "sample_name": "7",
        "metadata_1": "2000-01-01",
        "metadata_2": "2002-01-01",
        "metadata_3": "",
        "metadata_4": ""
    },
    {
        "sample": "sample8",
        "sample_name": "8",
        "metadata_1": "2000-02-29",
        "metadata_2": "2024-02-29",
        "metadata_3": "",
        "metadata_4": ""
    },
    {
        "sample": "sample9",
        "sample_name": "9",
        "metadata_1": "1950-12-31",
        "metadata_2": "2000-05-05",
        "metadata_3": "",
        "metadata_4": ""
    },
    {
        "sample": "sample10",
        "sample_name": "10",
        "metadata_1": "",
        "metadata_2": "",
        "metadata_3": "1",
        "metadata_4": "day"
    },
    {
        "sample": "sample11",
        "sample_name": "11",
        "metadata_1": "",
        "metadata_2": "",
        "metadata_3": "2",
        "metadata_4": "days"
    },
    {
        "sample": "sample12",
        "sample_name": "12",
        "metadata_1": "",
        "metadata_2": "",
        "metadata_3": "3",
        "metadata_4": "days"
    },
    {
        "sample": "sample13",
        "sample_name": "13",
        "metadata_1": "",
        "metadata_2": "",
        "metadata_3": "365",
        "metadata_4": "days"
    },
    {
        "sample": "sample14",
        "sample_name": "14",
        "metadata_1": "",
        "metadata_2": "",
        "metadata_3": "729",
        "metadata_4": "days"
    },
    {
        "sample": "sample15",
        "sample_name": "15",
        "metadata_1": "",
        "metadata_2": "",
        "metadata_3": "730",
        "metadata_4": "days"
    },
    {
        "sample": "sample16",
        "sample_name": "16",
        "metadata_1": "",
        "metadata_2": "",
        "metadata_3": "731",
        "metadata_4": "days"
    },
    {
        "sample": "sample17",
        "sample_name": "17",
        "metadata_1": "",
        "metadata_2": "",
        "metadata_3": "1",
        "metadata_4": "week"
    },
    {
        "sample": "sample18",
        "sample_name": "18",
        "metadata_1": "",
        "metadata_2": "",
        "metadata_3": "2",
        "metadata_4": "weeks"
    },
    {
        "sample": "sample19",
        "sample_name": "19",
        "metadata_1": "",
        "metadata_2": "",
        "metadata_3": "52",
        "metadata_4": "weeks"
    },
    {
        "sample": "sample20",
        "sample_name": "20",
        "metadata_1": "",
        "metadata_2": "",
        "metadata_3": "104",
        "metadata_4": "weeks"
    },
    {
        "sample": "sample21",
        "sample_name": "21",
        "metadata_1": "",
        "metadata_2": "",
        "metadata_3": "1",
        "metadata_4": "month"
    },
    {
        "sample": "sample22",
        "sample_name": "22",
        "metadata_1": "",
        "metadata_2": "",
        "metadata_3": "2",
        "metadata_4": "months"
    },
    {
        "sample": "sample23",
        "sample_name": "23",
        "metadata_1": "",
        "metadata_2": "",
        "metadata_3": "12",
        "metadata_4": "months"
    },
    {
        "sample": "sample24",
        "sample_name": "24",
        "metadata_1": "",
        "metadata_2": "",
        "metadata_3": "24",
        "metadata_4": "months"
    },
    {
        "sample": "sample25",
        "sample_name": "25",
        "metadata_1": "",
        "metadata_2": "",
        "metadata_3": "1",
        "metadata_4": "year"
    },
    {
        "sample": "sample26",
        "sample_name": "26",
        "metadata_1": "",
        "metadata_2": "",
        "metadata_3": "2",
        "metadata_4": "years"
    },
    {
        "sample": "sample27",
        "sample_name": "27",
        "metadata_1": "",
        "metadata_2": "",
        "metadata_3": "3",
        "metadata_4": "years"
    },
    {
        "sample": "sample28",
        "sample_name": "28",
        "metadata_1": "2000-01-02",
        "metadata_2": "2000-01-02",
        "metadata_3": "1",
        "metadata_4": "day"
    },
    {
        "sample": "sample29",
        "sample_name": "29",
        "metadata_1": "2000-01-01",
        "metadata_2": "2000-12-31",
        "metadata_3": "366",
        "metadata_4": "day"
    }
]
