[
    {
        "sample": "sample1",
        "sample_name": "basic1",
        "metadata_1": "10",
        "metadata_2": "year",
        "metadata_3": "2010-01-01",
        "metadata_4": "Homo sapiens (Human)",
        "metadata_5": "Human NCBITaxon:9606",
        "metadata_6": "",
        "metadata_7": "",
        "metadata_8": "",
        "metadata_9": "2020-01-01",
        "metadata_10": "2020-01-02",
        "metadata_11": "2020-01-03",
        "metadata_12": "2020-01-04",
        "metadata_13": "2020-01-05",
        "metadata_14": "2020-01-06"
    }
]
