[
  {
    "sample": "sample1",
    "sample_name": "ABC",
    "metadata_1": "2000-01-01",
    "metadata_2": "2000-12-31",
    "metadata_3": "",
    "metadata_4": "",
    "metadata_5": "",
    "metadata_6": "",
    "metadata_7": "",
    "metadata_8": ""
  },
  {
    "sample": "sample2",
    "sample_name": "DEF",
    "metadata_1": "2000-02-29",
    "metadata_2": "2024-02-29",
    "metadata_3": "",
    "metadata_4": "",
    "metadata_5": "",
    "metadata_6": "",
    "metadata_7": "",
    "metadata_8": ""
  },
  {
    "sample": "sample3",
    "sample_name": "GHI",
    "metadata_1": "1950-12-31",
    "metadata_2": "2000-05-05",
    "metadata_3": "",
    "metadata_4": "",
    "metadata_5": "",
    "metadata_6": "",
    "metadata_7": "",
    "metadata_8": ""
  }
]