[
    {
        "sample": "sample1",
        "sample_name": "normal",
        "metadata_1": "2000-01-01",
        "metadata_2": "2000-01-02",
        "metadata_3": "2000-01-03",
        "metadata_4": "2000-01-04",
        "metadata_5": "2000-01-05",
        "metadata_6": "2000-01-06",
        "metadata_7": "2000-01-07",
        "metadata_8": "2000-01-08"
    },
    {
        "sample": "sample2",
        "sample_name": "all_missing",
        "metadata_1": "",
        "metadata_2": "",
        "metadata_3": "",
        "metadata_4": "",
        "metadata_5": "",
        "metadata_6": "",
        "metadata_7": "",
        "metadata_8": ""
    },
    {
        "sample": "sample3",
        "sample_name": "some_missing",
        "metadata_1": "",
        "metadata_2": "2000-03-02",
        "metadata_3": "",
        "metadata_4": "2000-03-04",
        "metadata_5": "",
        "metadata_6": "2000-03-06",
        "metadata_7": "",
        "metadata_8": "2000-03-08"
    },
    {
        "sample": "sample4",
        "sample_name": "only_non_strings",
        "metadata_1": "12",
        "metadata_2": "",
        "metadata_3": "a",
        "metadata_4": "",
        "metadata_5": "0.5",
        "metadata_6": "",
        "metadata_7": "",
        "metadata_8": "1"
    },
    {
        "sample": "sample5",
        "sample_name": "only_bad_dates",
        "metadata_1": "2000-30-12",
        "metadata_2": "",
        "metadata_3": "",
        "metadata_4": "",
        "metadata_5": "",
        "metadata_6": "",
        "metadata_7": "",
        "metadata_8": "2000-30-01"
    },
    {
        "sample": "sample6",
        "sample_name": "mix_good_bad_dates",
        "metadata_1": "2000-01-01",
        "metadata_2": "2000-01-02",
        "metadata_3": "",
        "metadata_4": "",
        "metadata_5": "",
        "metadata_6": "",
        "metadata_7": "2000-30-12",
        "metadata_8": "2000-30-01"
    },
    {
        "sample": "sample7",
        "sample_name": "mix_dates_non_dates",
        "metadata_1": "2000-01-01",
        "metadata_2": "2000-01-02",
        "metadata_3": "",
        "metadata_4": "",
        "metadata_5": "",
        "metadata_6": "",
        "metadata_7": "cat",
        "metadata_8": "0.5"
    },
    {
        "sample": "sample8",
        "sample_name": "only_one_integer",
        "metadata_1": "1",
        "metadata_2": "",
        "metadata_3": "",
        "metadata_4": "",
        "metadata_5": "",
        "metadata_6": "",
        "metadata_7": "",
        "metadata_8": ""
    },
    {
        "sample": "sample9",
        "sample_name": "only_one_float",
        "metadata_1": "0.1",
        "metadata_2": "",
        "metadata_3": "",
        "metadata_4": "",
        "metadata_5": "",
        "metadata_6": "",
        "metadata_7": "",
        "metadata_8": ""
    },
    {
        "sample": "sample10",
        "sample_name": "only_one_string",
        "metadata_1": "cat",
        "metadata_2": "",
        "metadata_3": "",
        "metadata_4": "",
        "metadata_5": "",
        "metadata_6": "",
        "metadata_7": "",
        "metadata_8": ""
    },
    {
        "sample": "sample11",
        "sample_name": "only_one_char",
        "metadata_1": "a",
        "metadata_2": "",
        "metadata_3": "",
        "metadata_4": "",
        "metadata_5": "",
        "metadata_6": "",
        "metadata_7": "",
        "metadata_8": ""
    },
    {
        "sample": "sample12",
        "sample_name": "only_one_date",
        "metadata_1": "2000-01-01",
        "metadata_2": "",
        "metadata_3": "",
        "metadata_4": "",
        "metadata_5": "",
        "metadata_6": "",
        "metadata_7": "",
        "metadata_8": ""
    },
    {
        "sample": "sample13",
        "sample_name": "one_integer_one_date",
        "metadata_1": "1",
        "metadata_2": "",
        "metadata_3": "",
        "metadata_4": "",
        "metadata_5": "",
        "metadata_6": "",
        "metadata_7": "",
        "metadata_8": "2000-01-01"
    },
    {
        "sample": "sample14",
        "sample_name": "one_float_one_date",
        "metadata_1": "0.1",
        "metadata_2": "",
        "metadata_3": "",
        "metadata_4": "",
        "metadata_5": "",
        "metadata_6": "",
        "metadata_7": "",
        "metadata_8": "2000-01-01"
    },
    {
        "sample": "sample15",
        "sample_name": "one_string_one_date",
        "metadata_1": "cat",
        "metadata_2": "",
        "metadata_3": "",
        "metadata_4": "",
        "metadata_5": "",
        "metadata_6": "",
        "metadata_7": "",
        "metadata_8": "2000-01-01"
    },
    {
        "sample": "sample16",
        "sample_name": "one_char_one_date",
        "metadata_1": "a",
        "metadata_2": "",
        "metadata_3": "",
        "metadata_4": "",
        "metadata_5": "",
        "metadata_6": "",
        "metadata_7": "",
        "metadata_8": "2000-01-01"
    },
    {
        "sample": "sample17",
        "sample_name": "many_integer_one_date",
        "metadata_1": "1",
        "metadata_2": "2",
        "metadata_3": "3",
        "metadata_4": "4",
        "metadata_5": "5",
        "metadata_6": "6",
        "metadata_7": "7",
        "metadata_8": "2000-01-01"
    },
    {
        "sample": "sample18",
        "sample_name": "many_float_one_date",
        "metadata_1": "0.1",
        "metadata_2": "0.2",
        "metadata_3": "0.3",
        "metadata_4": "0.4",
        "metadata_5": "0.5",
        "metadata_6": "0.6",
        "metadata_7": "0.7",
        "metadata_8": "2000-01-01"
    },
    {
        "sample": "sample19",
        "sample_name": "many_string_one_date",
        "metadata_1": "cat",
        "metadata_2": "dog",
        "metadata_3": "fish",
        "metadata_4": "hamster",
        "metadata_5": "rat",
        "metadata_6": "mouse",
        "metadata_7": "bird",
        "metadata_8": "2000-01-01"
    },
    {
        "sample": "sample20",
        "sample_name": "many_char_one_date",
        "metadata_1": "a",
        "metadata_2": "b",
        "metadata_3": "c",
        "metadata_4": "d",
        "metadata_5": "e",
        "metadata_6": "f",
        "metadata_7": "g",
        "metadata_8": "2000-01-01"
    },
    {
        "sample": "sample21",
        "sample_name": "one_integer_many_date",
        "metadata_1": "1",
        "metadata_2": "2000-01-01",
        "metadata_3": "2000-01-02",
        "metadata_4": "2000-01-03",
        "metadata_5": "2000-01-04",
        "metadata_6": "2000-01-05",
        "metadata_7": "2000-01-06",
        "metadata_8": "2000-01-07"
    },
    {
        "sample": "sample22",
        "sample_name": "one_float_many_date",
        "metadata_1": "0.1",
        "metadata_2": "2000-01-01",
        "metadata_3": "2000-01-02",
        "metadata_4": "2000-01-03",
        "metadata_5": "2000-01-04",
        "metadata_6": "2000-01-05",
        "metadata_7": "2000-01-06",
        "metadata_8": "2000-01-07"
    },
    {
        "sample": "sample23",
        "sample_name": "one_string_many_date",
        "metadata_1": "cat",
        "metadata_2": "2000-01-01",
        "metadata_3": "2000-01-02",
        "metadata_4": "2000-01-03",
        "metadata_5": "2000-01-04",
        "metadata_6": "2000-01-05",
        "metadata_7": "2000-01-06",
        "metadata_8": "2000-01-07"
    },
    {
        "sample": "sample24",
        "sample_name": "one_char_many_date",
        "metadata_1": "a",
        "metadata_2": "2000-01-01",
        "metadata_3": "2000-01-02",
        "metadata_4": "2000-01-03",
        "metadata_5": "2000-01-04",
        "metadata_6": "2000-01-05",
        "metadata_7": "2000-01-06",
        "metadata_8": "2000-01-07"
    },
    {
        "sample": "sample25",
        "sample_name": "duplicates",
        "metadata_1": "2000-01-01",
        "metadata_2": "2000-01-01",
        "metadata_3": "2000-01-01",
        "metadata_4": "2000-01-01",
        "metadata_5": "2000-01-01",
        "metadata_6": "2000-01-01",
        "metadata_7": "2000-01-01",
        "metadata_8": "2000-01-01"
    },
    {
        "sample": "sample26",
        "sample_name": "duplicates_missing",
        "metadata_1": "2000-01-01",
        "metadata_2": "",
        "metadata_3": "2000-01-01",
        "metadata_4": "",
        "metadata_5": "2000-01-01",
        "metadata_6": "",
        "metadata_7": "2000-01-01",
        "metadata_8": ""
    },
    {
        "sample": "sample27",
        "sample_name": "duplicates_mixed",
        "metadata_1": "2000-01-01",
        "metadata_2": "2000-01-01",
        "metadata_3": "2000-01-01",
        "metadata_4": "2000-01-01",
        "metadata_5": "2000-01-02",
        "metadata_6": "2000-01-02",
        "metadata_7": "2000-01-02",
        "metadata_8": "2000-01-02"
    }
]
