[
  {
    "sample": "sample1",
    "sample_name": "ABC",
    "metadata_1": "1.1",
    "metadata_2": "1.2",
    "metadata_3": "1.3",
    "metadata_4": "",
    "metadata_5": "1.5",
    "metadata_6": "1.6",
    "metadata_7": "1.7",
    "metadata_8": "1.8"
  },
  {
    "sample": "sample2",
    "sample_name": "DEF",
    "metadata_1": "2.1",
    "metadata_2": "2.2",
    "metadata_3": "2.3",
    "metadata_4": "",
    "metadata_5": "2.5",
    "metadata_6": "2.6",
    "metadata_7": "2.7",
    "metadata_8": "2.8"
  },
  {
    "sample": "sample3",
    "sample_name": "GHI",
    "metadata_1": "3.1",
    "metadata_2": "3.2",
    "metadata_3": "3.3",
    "metadata_4": "",
    "metadata_5": "3.5",
    "metadata_6": "3.6",
    "metadata_7": "3.7",
    "metadata_8": "3.8"
  }
]