[
  {
    "sample": "sample1",
    "sample_name": "basic1",
    "metadata_1": "2020-01-01",
    "metadata_2": "2020-01-02",
    "metadata_3": "2020-01-03",
    "metadata_4": "2020-01-04",
    "metadata_5": "2020-01-05",
    "metadata_6": "2020-01-06",
    "metadata_7": "10",
    "metadata_8": "year",
    "metadata_9": "2010-01-01",
    "metadata_10": "Homo sapiens (Human)",
    "metadata_11": "Human NCBITaxon:9606",
    "metadata_12": "",
    "metadata_13": "",
    "metadata_14": ""
  }
]