[
  {
    "sample": "sample1",
    "sample_name": "basic1",
    "metadata_1": "2020-01-01",
    "metadata_2": "2020-01-02",
    "metadata_3": "2020-01-03",
    "metadata_4": "2020-01-04",
    "metadata_5": "2020-01-05",
    "metadata_6": "2020-01-06",
    "metadata_7": "10",
    "metadata_8": "year",
    "metadata_9": "2010-01-01",
    "metadata_10": "A, B",
    "metadata_11": "C, D, E",
    "metadata_12": "",
    "metadata_13": "",
    "metadata_14": ""
  },
  {
    "sample": "sample2",
    "sample_name": "basic2",
    "metadata_1": "2020-01-01",
    "metadata_2": "2020-01-02",
    "metadata_3": "2020-01-03",
    "metadata_4": "2020-01-04",
    "metadata_5": "2020-01-05",
    "metadata_6": "2020-01-06",
    "metadata_7": "10",
    "metadata_8": "year",
    "metadata_9": "2010-01-01",
    "metadata_10": ",,,",
    "metadata_11": "",
    "metadata_12": "",
    "metadata_13": "",
    "metadata_14": ""
  },
  {
    "sample": "sample3",
    "sample_name": "basic3",
    "metadata_1": "2020-01-01",
    "metadata_2": "2020-01-02",
    "metadata_3": "2020-01-03",
    "metadata_4": "2020-01-04",
    "metadata_5": "2020-01-05",
    "metadata_6": "2020-01-06",
    "metadata_7": "10",
    "metadata_8": "year",
    "metadata_9": "2010-01-01",
    "metadata_10": "F,",
    "metadata_11": ",G",
    "metadata_12": "",
    "metadata_13": "",
    "metadata_14": ""
  },
  {
    "sample": "sample4",
    "sample_name": "basic4",
    "metadata_1": "2020-01-01",
    "metadata_2": "2020-01-02",
    "metadata_3": "2020-01-03",
    "metadata_4": "2020-01-04",
    "metadata_5": "2020-01-05",
    "metadata_6": "2020-01-06",
    "metadata_7": "10",
    "metadata_8": "year",
    "metadata_9": "2010-01-01",
    "metadata_10": "Chicken breast (skinless, boneless)",
    "metadata_11": "Chicken breast (skinless, boneless)",
    "metadata_12": "",
    "metadata_13": "",
    "metadata_14": ""
  }
]