[
  {
    "sample": "sample1",
    "sample_name": "ABC",
    "metadata_1": "",
    "metadata_2": "1.2",
    "metadata_3": "1.3",
    "metadata_4": "",
    "metadata_5": "1.5",
    "metadata_6": "1.6",
    "metadata_7": "",
    "metadata_8": ""
  },
  {
    "sample": "sample2",
    "sample_name": "",
    "metadata_1": "2.1",
    "metadata_2": "",
    "metadata_3": "2.3",
    "metadata_4": "2.4",
    "metadata_5": "",
    "metadata_6": "2.6",
    "metadata_7": "2.7",
    "metadata_8": ""
  },
  {
    "sample": "sample3",
    "sample_name": "GHI",
    "metadata_1": "3.1",
    "metadata_2": "3.2",
    "metadata_3": "",
    "metadata_4": "3.4",
    "metadata_5": "3.5",
    "metadata_6": "",
    "metadata_7": "3.7",
    "metadata_8": ""
  }
]